231002;2000000000831;GT5-LP5-RC;Зарядное устройство GT5-LP5-RC для Linea Pro 5.0 на 5 устройств с чехлом повышенной защиты;;583;13300;231002.jpg
231007;CASE-CS-LP5-PG;CS-LP5-PG;Ручка-пистолет для Linea Pro 5 2D;;190;17400;231007.jpg
231003;2000000000848;CS-R-LP52D-STR-G/BK;Чехол повышенной прочности для Linea Pro 5.0;;3560;2200;231003.jpg
231017;820256309623;HOL-LP5-C-W-SHL;Чехол для Linea Pro 5 c наплечным ремнем;;15;2400;231017.jpg
230008;2000000001067;DPH-LP5IPDMSRBT2D-I;Чехол-расширитель Linea Pro 5.0 для iPod 2D Intermec BT;;817;33400;230008.jpg
230014;2000000001265;DPH-LP6IPHMSRBT2D-I;Чехол-расширитель Linea Pro 6.0 для iPhone 6/6s  BT 2D Intermec;;236;34800;230014.jpg
231010;2000000001289;CS-R-LP62DGF-G/BK;Чехол повышенной защиты для Linea Pro 6 2D;;315;2500;231010.jpg
210001;2000000000770;DPH-BP500IPD2DNLBTN;Чехол-расширитель Linea BluePad-500 2D NL для iPod 5/6, BT, NFC;;514;30000;210001.jpg
210005;2000000001029;DPH-BP50N;Терминал приема оплаты Datecs BluePad-50 NFC;;7625;12400;210005.jpg
210003;2000000000824;DST-50RS;Подставка-стойка для Datecs BluePad-50 с интерфейсом RS232;;39;3800;210003.jpg
220001;2000000000961;DPH-ITMMSRRFBT2D-NL;Чехол-расширитель InfineaTab mini для iPad mini/Air 1/ Air 2/ 2D Newland, NFC,BT;;482;26000;220001.jpg
221002;2000000000923;CS-TML-PLP;Поворотная ручка для для чехла повышенной защиты InfineaTAB mini и iPad mini;;232;4300;221002.jpg
221003;2000000000930;GT1-ITMA-LC;Зарядная док-станция для InfineaTAB mini и iPad Air c чехлом повышенной защиты;;15;6700;221003.jpg
221005;2000000000954;GT1-ITM-LC;Зарядная док-станция для InfineaTAB mini и iPad mini c чехлом повышенной защиты;;84;6700;221005.jpg
232101;2000000001517;PSIX5-POD5-BK;Зарядное устройство для Infinea X iPod на 5 устройств;;70;46200;232101.png
232001;2000000001487;IX-I2DBTR-PH5-BK;Чехол-расширитель Infinea X для iPhone RFID BT 2D Intermec;;193;42000;232001.png
270001;2000000000763;DBS-55;Портативный сканер штрих-кода Datecs BlueScan DBS-55 Bluetooth;;587;13700;270001.jpg
240003;2000000000787;DPP-450BT/WI-FI;Принтер этикеток DATECS DPP-450 BT, WiFi;;1118;38500;240003.jpg
241001;2000000000893;DPH-CASEDPP450BK;Чехол для мобильного термопринтера Datecs DPP-450 Holster;;1403;2500;241001.jpg
241002;2000000000909;DPH-CASEDPP450BLW;Чехол для мобильного термопринтера Datecs DPP-450 Holster, синий, с дополнительным окном;;102;2900;241002.jpg
240002;2000000000732;DPP-255BT/WI-FI;Портативный принтер этикеток и чеков DATECS DPP-255BT/WI-FI;;2563;27700;240002.jpg
210009;2000000001616;DPH-BP5000CBK;Терминал приема оплаты Datecs BluePad-5000 Color TFT;;238;15800;210009.jpg
231015;2000000001296;GT1-LP6-RC;Зарядное устройство GT1-LP6-RC для Linea Pro 6 на 1 устройство c чехлом повышенной защиты;;115;11500;231015.jpg
280010;3000000001297;WA-3456;Рубашка SAND;48;43;12000;280010.png
280011;3000000001298;WA-3457;Куртка ARCTIC;46;45;14500;280011.png
280012;3000000001299;WA-3458;Футболка ARMANI;M;65;7699;280012.png
280013;3000000001300;WA-3459;Джемпер MOSCHINO;M;75;13500;280013.png
280014;3000000001301;WA-3460;Куртка спортивная MEUCCI;M;23;9300;280014.png
280015;3000000001302;WA-3461;Рубашка-поло DANIEL'S;M;56;5799;280015.png
280016;3000000001303;WA-3462;Рубашка-поло PORSCHE DESIGN;M;87;9300;280016.png
280017;3000000001304;WA-3463;Рубашка-поло Fabrizio Del Carlo;S;899;3600;280017.png